{
  "$schema": "../Output/Schema/General.settings.schema.json",
  "allowMergeConflicts": true,
  "name": "eac",
  "ecucSplitter": {
    "enabled": true,
    "manualMapping": {
      "enabled": false,
      "useDefaultMapping": false
    },
    "ownFileForEachInstance": false,
    "ownFolderForEachSplitter": false
  },
  "environment": {
    "compiler": {
      "value": ""
    },
    "derivative": {
      "value": ""
    },
    "pinLayout": "",
    "postBuildLoadableSupport": false,
    "postBuildSelectableSupport": false,
    "projectType": {
      "domain": "SystemExtractProject",
      "type": "Standard"
    },
    "sipIds": ["<SipId>"],
    "syncJobRole": "None",
    "targetType": "Real Target",
    "useCases": []
  },
  "folders": {
    "genData": "../Output/Source/GenData",
    "logs": "../Output/Log",
    "mcData": "../Output/Source/McData",
    "source": "../Output/Source/Templates",
    "trace": "../Output/Trace",
    "genDataVtt": "../Output/Source/GenDataVtt"
  },
  "author": "",
  "ecuc": {
    "activeModelRootPackage": "/ActiveEcuC/ActiveEcuC"
  },
  "postBuildLoadable": {
    "currentConfigurationPhase": "PRE_COMPILE",
    "rteDataFreezeChecksum": ""
  },
  "version": "1.0"
}
